[
  {
    "id": "mus_p001",
    "name": "节奏感培养",
    "subject": "music",
    "domain": "音乐表现",
    "grade": 1,
    "semester": "上",
    "chapter": "一年级上册 第一单元",
    "type": "conceptual",
    "description": "能跟随音乐拍手、跺脚，感受强弱规律和节拍",
    "mastery_criteria": [
      "能跟随音乐拍手、跺脚，感受强弱规律和节拍"
    ],
    "diagnostic_question": {
      "question": "关于「节奏感培养」，以下哪个说法正确？",
      "answer": "A"
    },
    "external": false,
    "standards": [
      {
        "id": "mus-2022:1.TS.01",
        "confidence": "exact",
        "quote": "以培养学生的节奏感、韵律感和初步的艺术表现能力",
        "sourceLine": 661
      }
    ],
    "tags": [
      "音乐表现"
    ],
    "prerequisites": [],
    "curriculumRef": "mus-2022:1.TS.01",
    "verified": false
  },
  {
    "id": "mus_p002",
    "name": "音的高低",
    "subject": "music",
    "domain": "音乐表现",
    "grade": 1,
    "semester": "上",
    "chapter": "一年级上册 第二单元",
    "type": "conceptual",
    "description": "能辨别声音的高低，用动作或简单图形表示音的高低变化",
    "mastery_criteria": [
      "能辨别声音的高低，用动作或简单图形表示音的高低变化"
    ],
    "diagnostic_question": {
      "question": "关于「音的高低」，以下哪个说法正确？",
      "answer": "A"
    },
    "external": false,
    "standards": [
      {
        "id": "mus-2022:1.KC.02",
        "confidence": "partial",
        "quote": "能举例说明生活和自然界中声音的特点，能运用人声、乐器",
        "sourceLine": 873
      }
    ],
    "tags": [
      "音乐感知"
    ],
    "prerequisites": [
      "mus_p001"
    ],
    "curriculumRef": "mus-2022:1.KC.02",
    "verified": false
  },
  {
    "id": "mus_p003",
    "name": "歌唱姿势与呼吸",
    "subject": "music",
    "domain": "音乐表现",
    "grade": 1,
    "semester": "上",
    "chapter": "一年级上册 歌唱",
    "type": "procedural",
    "description": "掌握正确的歌唱姿势和自然呼吸方法，能用自然的声音演唱",
    "mastery_criteria": [
      "掌握正确的歌唱姿势和自然呼吸方法，能用自然的声音演唱"
    ],
    "diagnostic_question": {
      "question": "关于「歌唱姿势与呼吸」，以下哪个说法正确？",
      "answer": "A"
    },
    "external": false,
    "standards": [
      {
        "id": "mus-2022:1.KC.03",
        "confidence": "exact",
        "quote": "能用正确的姿势、自然的声音，有感情地独唱或齐唱",
        "sourceLine": 675
      }
    ],
    "tags": [
      "歌唱技能"
    ],
    "prerequisites": [],
    "curriculumRef": "mus-2022:1.KC.03",
    "verified": false
  },
  {
    "id": "mus_p004",
    "name": "简单歌曲演唱",
    "subject": "music",
    "domain": "音乐表现",
    "grade": 1,
    "semester": "上",
    "chapter": "一年级上册 歌曲",
    "type": "conceptual",
    "description": "能背唱3-5首简单儿歌，音准节奏基本正确",
    "mastery_criteria": [
      "能背唱3-5首简单儿歌，音准节奏基本正确"
    ],
    "diagnostic_question": {
      "question": "关于「简单歌曲演唱」，以下哪个说法正确？",
      "answer": "A"
    },
    "external": false,
    "standards": [
      {
        "id": "mus-2022:1.TS.04",
        "confidence": "exact",
        "quote": "趣味唱游是以歌唱为主，融合演奏、声势、律动、即兴表演",
        "sourceLine": 656
      }
    ],
    "tags": [
      "歌唱表现"
    ],
    "prerequisites": [
      "mus_p003"
    ],
    "curriculumRef": "mus-2022:1.TS.04",
    "verified": false
  },
  {
    "id": "mus_p005",
    "name": "认识简谱(1-5)",
    "subject": "music",
    "domain": "音乐表现",
    "grade": 2,
    "semester": "上",
    "chapter": "二年级上册 乐理",
    "type": "conceptual",
    "description": "认识简谱do re mi fa sol(1 2 3 4 5)，能跟琴模唱",
    "mastery_criteria": [
      "认识简谱do re mi fa sol(1 2 3 4 5)，能跟琴模唱"
    ],
    "diagnostic_question": {
      "question": "关于「认识简谱(1-5)」，以下哪个说法正确？",
      "answer": "A"
    },
    "external": false,
    "standards": [
      {
        "id": "mus-2022:1.KC.05",
        "confidence": "exact",
        "quote": "唱名及常见的音乐记号，模唱简单旋律",
        "sourceLine": 671
      }
    ],
    "tags": [
      "乐理知识"
    ],
    "prerequisites": [
      "mus_p002"
    ],
    "curriculumRef": "mus-2022:1.KC.05",
    "verified": false
  },
  {
    "id": "mus_p006",
    "name": "节拍(2/4 3/4)",
    "subject": "music",
    "domain": "音乐表现",
    "grade": 2,
    "semester": "上",
    "chapter": "二年级上册 乐理",
    "type": "conceptual",
    "description": "认识2/4拍和3/4拍的强弱规律，能随音乐打拍子",
    "mastery_criteria": [
      "认识2/4拍和3/4拍的强弱规律，能随音乐打拍子"
    ],
    "diagnostic_question": {
      "question": "关于「节拍(2/4 3/4)」，以下哪个说法正确？",
      "answer": "A"
    },
    "external": false,
    "standards": [
      {
        "id": "mus-2022:1.KC.06",
        "confidence": "exact",
        "quote": "能跟随音乐的节拍拍手或走步，并对二拍子、三拍子音乐做出",
        "sourceLine": 754
      }
    ],
    "tags": [
      "乐理知识"
    ],
    "prerequisites": [
      "mus_p001",
      "mus_p005"
    ],
    "curriculumRef": "mus-2022:1.KC.06",
    "verified": false
  },
  {
    "id": "mus_p007",
    "name": "打击乐器演奏",
    "subject": "music",
    "domain": "音乐表现",
    "grade": 2,
    "semester": "下",
    "chapter": "二年级下册 器乐",
    "type": "conceptual",
    "description": "能使用木鱼、响板、铃鼓等打击乐器为歌曲伴奏",
    "mastery_criteria": [
      "能使用木鱼、响板、铃鼓等打击乐器为歌曲伴奏"
    ],
    "diagnostic_question": {
      "question": "关于「打击乐器演奏」，以下哪个说法正确？",
      "answer": "A"
    },
    "external": false,
    "standards": [
      {
        "id": "mus-2022:1.KC.07",
        "confidence": "partial",
        "quote": "会演奏简单的锣鼓经片段或其他节奏型，能进行独奏、合奏",
        "sourceLine": 683
      }
    ],
    "tags": [
      "器乐表现"
    ],
    "prerequisites": [
      "mus_p006"
    ],
    "curriculumRef": "mus-2022:1.KC.07",
    "verified": false
  },
  {
    "id": "mus_p008",
    "name": "音乐欣赏(中国民歌)",
    "subject": "music",
    "domain": "音乐鉴赏",
    "grade": 3,
    "semester": "上",
    "chapter": "三年级上册 欣赏",
    "type": "conceptual",
    "description": "聆听中国民歌，感受不同地区民歌的风格特点",
    "mastery_criteria": [
      "聆听中国民歌，感受不同地区民歌的风格特点"
    ],
    "diagnostic_question": {
      "question": "关于「音乐欣赏(中国民歌)」，以下哪个说法正确？",
      "answer": "A"
    },
    "external": false,
    "standards": [
      {
        "id": "mus-2022:2.XY.08",
        "confidence": "exact",
        "quote": "具有一定的中国民歌、民族器乐曲和戏曲的听觉",
        "sourceLine": 961
      }
    ],
    "tags": [
      "音乐鉴赏"
    ],
    "prerequisites": [
      "mus_p004"
    ],
    "curriculumRef": "mus-2022:2.XY.08",
    "verified": false
  },
  {
    "id": "mus_p009",
    "name": "合唱初步",
    "subject": "music",
    "domain": "音乐表现",
    "grade": 3,
    "semester": "下",
    "chapter": "三年级下册 歌唱",
    "type": "conceptual",
    "description": "能参与二声部简单合唱，注意倾听其他声部",
    "mastery_criteria": [
      "能参与二声部简单合唱，注意倾听其他声部"
    ],
    "diagnostic_question": {
      "question": "关于「合唱初步」，以下哪个说法正确？",
      "answer": "A"
    },
    "external": false,
    "standards": [
      {
        "id": "mus-2022:2.KC.09",
        "confidence": "exact",
        "quote": "能区分独唱、齐唱、轮唱、合唱等基本演唱形式",
        "sourceLine": 955
      }
    ],
    "tags": [
      "歌唱表现"
    ],
    "prerequisites": [
      "mus_p004"
    ],
    "curriculumRef": "mus-2022:2.KC.09",
    "verified": false
  },
  {
    "id": "mus_p010",
    "name": "认识五线谱基础",
    "subject": "music",
    "domain": "音乐表现",
    "grade": 4,
    "semester": "上",
    "chapter": "四年级上册 乐理",
    "type": "conceptual",
    "description": "认识五线谱的线与间、高音谱号，能识读简单旋律",
    "mastery_criteria": [
      "认识五线谱的线与间、高音谱号，能识读简单旋律"
    ],
    "diagnostic_question": {
      "question": "关于「认识五线谱基础」，以下哪个说法正确？",
      "answer": "A"
    },
    "external": false,
    "standards": [
      {
        "id": "mus-2022:2.XY.10",
        "confidence": "partial",
        "quote": "能正确识读或拍击简单节奏谱",
        "sourceLine": 1194
      }
    ],
    "tags": [
      "乐理知识"
    ],
    "prerequisites": [
      "mus_p005"
    ],
    "curriculumRef": "mus-2022:2.XY.10",
    "verified": false
  },
  {
    "id": "mus_p011",
    "name": "竖笛演奏入门",
    "subject": "music",
    "domain": "音乐表现",
    "grade": 4,
    "semester": "上",
    "chapter": "四年级上册 器乐",
    "type": "procedural",
    "description": "掌握竖笛基本指法，能演奏简单乐曲",
    "mastery_criteria": [
      "掌握竖笛基本指法，能演奏简单乐曲"
    ],
    "diagnostic_question": {
      "question": "关于「竖笛演奏入门」，以下哪个说法正确？",
      "answer": "A"
    },
    "external": false,
    "standards": [
      {
        "id": "mus-2022:2.KC.11",
        "confidence": "partial",
        "quote": "能用打击乐器或其他课堂乐器进行独奏、简单的合奏",
        "sourceLine": 1355
      }
    ],
    "tags": [
      "器乐表现"
    ],
    "prerequisites": [
      "mus_p007",
      "mus_p010"
    ],
    "curriculumRef": "mus-2022:2.KC.11",
    "verified": false
  },
  {
    "id": "mus_p012",
    "name": "音乐欣赏(西方古典)",
    "subject": "music",
    "domain": "音乐鉴赏",
    "grade": 5,
    "semester": "上",
    "chapter": "五年级上册 欣赏",
    "type": "conceptual",
    "description": "聆听莫扎特、贝多芬等作曲家的代表作品，了解音乐体裁",
    "mastery_criteria": [
      "聆听莫扎特、贝多芬等作曲家的代表作品，了解音乐体裁"
    ],
    "diagnostic_question": {
      "question": "关于「音乐欣赏(西方古典)」，以下哪个说法正确？",
      "answer": "A"
    },
    "external": false,
    "standards": [
      {
        "id": "mus-2022:2.XY.12",
        "confidence": "partial",
        "quote": "在聆听、体验音乐时能始终将听觉注意力指向音乐",
        "sourceLine": 968
      }
    ],
    "tags": [
      "音乐鉴赏"
    ],
    "prerequisites": [
      "mus_p008"
    ],
    "curriculumRef": "mus-2022:2.XY.12",
    "verified": false
  },
  {
    "id": "mus_p013",
    "name": "歌曲创作初步",
    "subject": "music",
    "domain": "音乐创作",
    "grade": 5,
    "semester": "下",
    "chapter": "五年级下册 创作",
    "type": "conceptual",
    "description": "能为简单歌词配上旋律，或用节奏创编短小乐句",
    "mastery_criteria": [
      "能为简单歌词配上旋律，或用节奏创编短小乐句"
    ],
    "diagnostic_question": {
      "question": "关于「歌曲创作初步」，以下哪个说法正确？",
      "answer": "A"
    },
    "external": false,
    "standards": [
      {
        "id": "mus-2022:2.KC.13",
        "confidence": "partial",
        "quote": "感知、了解有代表性的世界民族民间音乐，以及优秀创作作品",
        "sourceLine": 1057
      }
    ],
    "tags": [
      "音乐创作"
    ],
    "prerequisites": [
      "mus_p010"
    ],
    "curriculumRef": "mus-2022:2.KC.13",
    "verified": false
  },
  {
    "id": "mus_p014",
    "name": "音乐与情感表达",
    "subject": "music",
    "domain": "音乐鉴赏",
    "grade": 6,
    "semester": "上",
    "chapter": "六年级上册 综合",
    "type": "conceptual",
    "description": "理解音乐如何表达喜怒哀乐等情感，能用语言描述音乐感受",
    "mastery_criteria": [
      "理解音乐如何表达喜怒哀乐等情感，能用语言描述音乐感受"
    ],